{"$schema":"https://json-schema.org/draft/2020-12/schema","$id":"https://axignal.com/schemas/scenarios-calibration-outcomes-fixtures.schema.json","type":"object","additionalProperties":false,"required":["schema_version","task_id","modules","fixture_classes","expected"],"properties":{"schema_version":{"const":"axignal.scenarios-calibration-outcomes-fixtures/v0.1"},"task_id":{"const":"AX-GE2E-P19-T01"},"modules":{"type":"array","minItems":8,"maxItems":8,"uniqueItems":true,"items":{"type":"string"}},"fixture_classes":{"type":"array","minItems":5,"maxItems":5,"uniqueItems":true,"items":{"type":"string"}},"expected":{"type":"object","additionalProperties":false,"required":["decision","canonical_delta","external_action_delta","model_promotion_delta"],"properties":{"decision":{"const":"DENY_EXCEPT_VALID"},"canonical_delta":{"const":0},"external_action_delta":{"const":0},"model_promotion_delta":{"const":0}}}}}
