{"schema_version":"axignal.scenarios-calibration-outcomes-fixtures/v0.1","task_id":"AX-GE2E-P19-T01","modules":["SCENARIO_REGISTRY","BASELINE_VINTAGE_SERVICE","TEMPORAL_HOLDOUT_ENGINE","FORECAST_PREDICTION_LEDGER","CALIBRATION_EVALUATION","OUTCOME_RECONCILIATION","MODEL_GOVERNANCE_DEMOTION","SCENARIO_OUTCOME_WORKSPACE"],"fixture_classes":["VALID","MISSING_REQUIRED","STALE_OR_REVISED","CONTRADICTORY","AUTHORITY_ESCALATION"],"expected":{"decision":"DENY_EXCEPT_VALID","canonical_delta":0,"external_action_delta":0,"model_promotion_delta":0}}
